Date,Headline,Sentence
"JANUARY 2, 20",Apple cuts sales forecast as China sales weaken; iPhone pricing in focus,"Apple Inc on Wednesday took the rare step of cutting its quarterly sales forecast, with Chief Executive Tim Cook blaming slowing iPhone sales in China, whose economy has been dragged down by uncertainty around U.S.-China trade relations."
"JANUARY 3, 20",US STOCKS-Futures rocked by Apple's China warning as earnings loom,"* Celgene soars on Bristol-Myers' $74 bln deal (Adds comments, updates prices)"
"JANUARY 3, 20",CANADA STOCKS-Futures slip as Apple's slashed quarter forecast hurts global stocks,"Futures for Canada's main stock index pointed to a lower opening on Thursday, following a broad selloff in Asian and European markets after Apple cut its sales forecast of its first fiscal quarter."
"JANUARY 3, 20",UPDATE 1-Apple's warning keeps downward pressure on German Bund yields,"* Italian 10-year bond yields jump 13 bps (Updates pricing, adds quote, colour on Italian bonds, Spanish bond sale)"
"JANUARY 3, 20",GLOBAL MARKETS-Apple bombshell sends investors to safe havens; 'flash crash' jolts currencies,* European shares open firmly in red; Frankfurt leads fallers
"JANUARY 3, 20",RPT-Apple's warning a bad omen for Wall Street bulls,Apple's warning on Wednesday about weak iPhone demand in the holiday quarter is a gloomy omen for Wall Street bulls hoping for an early gift in 2019 following December's steep selloff.
"JANUARY 3, 20",SE Asia Stocks-Philippines top gainer; Vietnam sinks on Apple woes,"* Vietnam closes at over 1-yr low, Apple's forecast cut weighs * Philippines climbs, Dec inflation expected at 6-month low By Rashmi Ashok Jan 3 (Reuters) - Philippine shares rallied on Thursday on expectations of positive inflation data, while stocks in technology export..."
"JANUARY 3, 20","EMERGING MARKETS-Emerging stocks, FX slide; Apple revenue warning hurts risk sentiment","* EM technology stocks hit heavily, investors rush for safety"
"JANUARY 3, 20","GLOBAL MARKETS-Apple bombshell rocks European, Asian shares; 'flash crash' jolts currencies",* European shares open firmly in red; Frankfurt leads fallers
"JANUARY 3, 20",Apple's warning keeps downward pressure on German Bund yields,German government bond yields held close to their lowest in over two years on Thursday after a rare revenue warning by U.S. tech giant Apple fuelled a flight to global safe assets amid renewed concerns about slowing Chinese growth.
"JANUARY 3, 20","Hong Kong stocks slip on Apple trouble, flat A-shares","Hong Kong stocks eased on Thursday after a rare revenue warning from Apple Inc spooked technology and hardware shares, and as investors found little support from the performance of Chinese equities. ** The Hang Seng index edged down 0.3 percent to 25,064.36, while the Hang..."
"JANUARY 3, 20",Apple warning shakes European shares as chipmakers tumble,Apple's first revenue warning in nearly 12 years sent European shares sliding on Thursday with the tech sector particularly badly bruised as chipmakers which supply to the iPhone maker fell sharply.
"JANUARY 3, 20","GLOBAL MARKETS-Apple, China worries pummel Asian shares; 'flash crash' jolts currencies",U.S. stock futures fell and Asian shares stumbled on Thursday after a rare revenue warning from Apple Inc added to worries about slowing global growth and weaker earnings and jolted currency markets.
"JANUARY 2, 20","GLOBAL MARKETS-Apple warning, China worries hit Asian shares; 'flash crash' jolts currencies",U.S. stock futures fell and Asian shares wobbled on Thursday after a rare revenue warning from Apple Inc added to worries about slowing global growth and weaker earnings.
"JANUARY 2, 20","For Warren Buffett, sinking Apple shares a wish come true",Billionaire Warren Buffett has said he would love to see Apple Inc shares decline in price so he could buy more. He is getting his wish.
"JANUARY 2, 20","For Warren Buffett, sinking Apple shares a wish come true",Billionaire Warren Buffett has said he would love to see Apple Inc shares decline in price so he could buy more. He is getting his wish.
"JANUARY 2, 20","Wall Street ekes out gain, Apple cuts revenue forecast after the bell","Wall Street edged higher on Wednesday after stumbling out of the starting gate on the first trading day of 2019, while fears of a global economic slowdown were exacerbated after Apple cut its holiday-quarter revenue forecast."
"JANUARY 2, 20","GLOBAL MARKETS-Shares skid as Apple warning stokes growth fears, 'flash crash' sweeps currencies","Shares in Asia fell on Thursday and U.S. stock futures dropped sharply after Apple Inc cut its revenue forecast due in part to weaker sales in China, adding to concerns about the slowing global economy."
"JANUARY 2, 20",Breakingviews - Apple sales warning is a Chinese joint venture,Apple's warning about slowing Chinese sales eroded more than $50 billion of its $750 billion market capitalization on Wednesday afternoon. It will also have taken a chunk out of confidence in the global economy. Investors don’t always believe China’s official economic data...
"JANUARY 2, 20","Global growth worries, higher oil flatten yield curve","Yields on long-dated U.S. Treasury securities fell to their lowest in nearly a year on Wednesday on concerns about the health of the global economy, a worry exacerbated late in the day when Apple Inc <AAPL.O> cut its sales outlook and sent U.S. equity index futures tumbling."
"JANUARY 2, 20",Apple lowers quarterly revenue forecast,"Apple Inc on Wednesday said its current quarter revenue will be lower than its original forecast, citing fewer iPhone upgrades and weakness in emerging markets."
"DECEMBER 27, ",Exclusive: Foxconn to begin assembling top-end Apple iPhones in India in 2019 - source,"Apple Inc will begin assembling its top-end iPhones in India through the local unit of Foxconn as early as 2019, the first time the Taiwanese contract manufacturer will have made the product in the country, according to a source familiar with the matter."
"DECEMBER 20, ",Apple to pull some iPhones in Germany as Qualcomm extends global wins,"Chip supplier Qualcomm Inc won a second court skirmish in its worldwide patent battle with Apple Inc on Thursday, with the iPhone maker saying it would pull some older models from its German stores."
"DECEMBER 20, ",Apple changes how it reports U.S. national security requests,"Apple Inc <AAPL.O> on Thursday changed how it reports on U.S. national security requests for user data, bringing its procedures more in line with those of technology rivals such as Microsoft Corp <MSFT.O> and Alphabet Inc's <GOOGL.O> Google."
"DECEMBER 20, ",German court rules Apple infringed Qualcomm patent,A German court ruled on Thursday that iPhone maker Apple Inc <AAPL.O> infringed a hardware patent of Qualcomm Inc <QCOM.O> and said the U.S. company could no longer sell some iPhone models in Germany which contain a particular component.
"DECEMBER 20, ",RPT-German court rules Apple infringed Qualcomm patent,A German court ruled on Thursday that iPhone maker Apple Inc infringed a hardware patent of Qualcomm Inc and said the U.S. company could no longer sell some iPhone models in Germany which contain a particular component.
"DECEMBER 18, ","Qualcomm says Apple violating Chinese court order, despite new software",Qualcomm Inc said it believes Apple Inc remains in violation of a Chinese court's orders to stop selling iPhones despite a software update that Apple pushed on Monday.
"DECEMBER 18, ",Switzerland says Apple pledges to fix disruptions to rival payment app,Switzerland's competition commission (WEKO) on Tuesday said Apple Inc has agreed to make a technical fix to prevent the automatic launch of its Apple Pay from disrupting rival Swiss payment app TWINT.
"DECEMBER 17, ","UPDATE 1-Qualcomm says Apple violating Chinese court order, despite new software",Qualcomm Inc said it believes Apple Inc remains in violation of a Chinese court's orders to stop selling iPhones despite a software update that Apple pushed on Monday.
"DECEMBER 18, ","Qualcomm says Apple violating Chinese court order, despite new software",Qualcomm Inc said it believes Apple Inc remains in violation of a Chinese court's orders to stop selling iPhones despite a software update that Apple pushed on Monday.
"DECEMBER 16, ",Foxconn not in settlement talks with Qualcomm in Apple battle: attorney,"The lead attorney for the group of Apple Inc device assemblers seeking at least $9 billion in damages from Qualcomm Inc said on Sunday the contract manufacturers are not in settlement talks with the mobile chip supplier and are ""gearing up and heading toward the trial"" in..."
"DECEMBER 16, ",Foxconn not in settlement talks with Qualcomm in Apple battle -attorney,"The lead attorney for the group of Apple Inc device assemblers seeking at least $9 billion in damages from Qualcomm Inc said on Sunday the contract manufacturers are not in settlement talks with the mobile chip supplier and are ""gearing up and heading toward the trial"" in..."
"DECEMBER 13, ",Apple to push software update in China as Qualcomm case threatens sales ban,"Apple Inc, facing a court ban in China on some of its iPhone models over alleged infringement of Qualcomm Inc patents, said on Friday it will push software updates to users in a bid to resolve potential issues."
"DECEMBER 13, ",Apple China says it will push software update in bid to resolve Qualcomm case,"Apple Inc , facing a court ban in China on some of its iPhone models over alleged infringement of Qualcomm Inc patents, said on Friday it will push software updates to users in a bid to resolve potential issues."
"DECEMBER 13, ","Apple plans new $1 billion campus for Austin, Texas","Apple Inc <AAPL.O> said on Thursday it would spend $1 billion to build a second campus in Austin, Texas, that will house up to 15,000 workers as part of a broader push by U.S. companies to create more domestic jobs."
"DECEMBER 13, ","Qualcomm to file suits in Chinese courts to ban iPhone XS, XR sales","Chipmaker Qualcomm Inc <QCOM.O> is asking courts in China to ban sales of Apple Inc's <AAPL.O> latest iPhone models XS and XR after winning a preliminary injunction against older models, the company confirmed on Thursday."
"DECEMBER 13, ",Qualcomm to file suits in Chinese courts to ban sales of iPhone XS and XR - FT,"Qualcomm Inc is asking courts in China to ban sales of Apple Inc's latest iPhone models XS and XR after winning a preliminary injunction against older models, the Financial Times reported on Thursday."
"DECEMBER 13, ",Apple to build new $1 bln campus in Texas,"Apple Inc said on Thursday it would invest $1 billion to build a new campus in North Austin, Texas."
"DECEMBER 12, ",U.S. tribunal to review ruling on Qualcomm request for iPhone ban,"The U.S. International Trade Commission (ITC) said on Wednesday it would review a ruling that a ban on imports of some iPhones into the United States was not in the public interest, even if Apple Inc <AAPL.O> infringed a Qualcomm <QCOM.O> patent."
"DECEMBER 11, ",Apple launches payments service in Germany following delay,"Apple has launched its mobile payments service in Germany, four years after its start in the United States and trailing Google, which started its payments app in the country in June."
"DECEMBER 10, ",China court bans sales of older iPhone models in Apple-Qualcomm global battle,"A Chinese court has ordered a sales ban of some older Apple Inc iPhone models in China for violating two patents of chipmaker Qualcomm Inc, though intellectual property lawyers said enforcement of the ban was likely still a distant threat."
"DECEMBER 10, ",EU's Vestager may investigate Apple Pay if there are formal complaints,"EU regulators looked into Apple's mobile payment service and found it was not market dominant but they could review it again if they receive formal complaints, Europe's antitrust chief said on Monday."
"DECEMBER 10, ",US STOCKS SNAPSHOT-Wall Street opens lower as Apple weighs,U.S. stocks opened lower on Monday after a drop in Apple Inc's shares curbed the market's attempt to stage a bounce back from its worst week since March on worries over global growth and the China-U.S. trade war.
"DECEMBER 10, ",Deep losses leave Big Tech with small earnings multiples,"Deep losses in Amazon Inc, Apple Inc, Facebook Inc and Alphabet Inc have left the former tech favorites at their lowest earnings multiples in years, offering potential bargains to cold-blooded investors looking to buy stocks at a time of heightened fear."
"DECEMBER 10, ",Qualcomm wins import ban against several Apple iPhones in China,Qualcomm Inc on Monday said it had won a preliminary order from a Chinese court banning the importation and sale of several Apple Inc iPhone models in China that the court found violated two of Qualcomm patents.
"DECEMBER 6, 2",Apple supplier Lumentum gets China approval for Oclaro deal,"Lumentum Holdings Inc, seen by analysts as a parts supplier for Apple Inc's Face ID technology, said on Thursday it received antitrust clearance from China for its $1.7 billion acquisition of Oclaro Inc."
"DECEMBER 6, 2",Apple supplier Lumentum receives China approval for Oclaro deal,Apple supplier Lumentum Holdings said on Thursday it received antitrust clearance from China for its $1.7 billion acquisition of Oclaro Inc.
"DECEMBER 4, 2",Apple assembler Foxconn considering iPhone factory in Vietnam -state media,"Foxconn, the world's biggest electronics contract manufacturer and a key Apple Inc supplier, is considering setting up a factory in Vietnam to mitigate any impact of an ongoing trade war between the United States and China, Vietnamese state media reported."
"DECEMBER 3, 2",Amazon briefly edges out Apple for most valuable company,"Amazon.com briefly became the most valuable company on Wall Street in intraday trade on Monday, days after Microsoft Corp dethroned long-time leader Apple Inc."
"DECEMBER 3, 2","Sharp Corp lays off 3,000 foreign staff, moves production to China - Nikkei","Sharp Corp has laid off more than 3,000 foreign workers in Japan as the Apple supplier shifts production of iPhone sensors to a Chinese plant owned by parent Foxconn, the Nikkei business daily reported on Monday."
"DECEMBER 3, 2",Amazon.com briefly becomes Wall Street's most valuable company,"Amazon.com briefly became the most valuable company on Wall Street in intraday trade on Monday, days after Microsoft Corp dethroned long-time leader Apple."
"DECEMBER 3, 2","Verizon, Samsung to release 5G smartphones in U.S. in 2019",Verizon Communications Inc and Samsung Electronics Co Ltd on Monday confirmed long-held industry expectations they would seek to steal a march on Apple Inc by launching U.S. 5G smartphones in the first half of 2019.
"DECEMBER 3, 2","CORRECTED-Verizon, Samsung to release 5G smartphones in U.S. in 2019",Verizon Communications Inc and Samsung Electronics Co Ltd said on Monday they plan to release 5G smartphones in the first half of 2019 in the United States.
"NOVEMBER 30, ",Microsoft's market value overtakes Apple's to close out week,Microsoft Corp's <MSFT.O> stock market value closed above Apple Inc's <AAPL.O> for the first time in eight years on Friday as the Windows maker benefited from growth in cloud computing while Apple was hit by investor concern about iPhone demand.
"NOVEMBER 30, ",Amazon to allow Apple Music on its Echo speakers,"Amazon.com Inc said on Friday Apple Music will become available on its Echo smart speakers starting Dec. 17, signaling increasing collaboration between the tech heavyweights."
"NOVEMBER 28, ","Apple's iPhone XR is company's best-selling model, executive says","Apple Inc's iPhone XR has been the company's best-selling iPhone model every day since it went on sale in mid-October, a company executive told Reuters on Wednesday."
"NOVEMBER 28, ",Microsoft's stock market value pulls ahead of Apple's,"Microsoft Corp's <MSFT.O> stock market value surpassed Apple Inc's <AAPL.O>, pulling ahead by as much as $3 billion on Wednesday as the Windows software maker benefited from optimism about demand for cloud computing services."
"NOVEMBER 28, ",Microsoft's stock market value pulls ahead of Apple's,Microsoft Corp's stock market value surpassed Apple Inc's and pulled ahead by as much as $3 billion on Wednesday as the Windows software maker benefited from optimism about demand for cloud computing services.
"NOVEMBER 26, ",Microsoft's stock market value catches up with Apple,"Just four months after Apple Inc <AAPL.O> breached the $1 trillion mark, the iPhone maker has lost its lead as Wall Street's most valuable company and is on the verge of being replaced by Microsoft Corp <MSFT.O>."
"NOVEMBER 26, ",Microsoft's stock market value catches up with Apple,"Just four months after Apple Inc breached the $1 trillion mark, the iPhone maker has all but lost its lead as Wall Street's most valuable company and is on the verge of being replaced by Microsoft Corp . Buoyed by a broad rebound in U.S. stocks on Monday, Microsoft jumped..."
"NOVEMBER 26, ",U.S. top court leans towards allowing Apple App Store antitrust suit,U.S. Supreme Court justices on Monday appeared open to letting a lawsuit proceed against Apple Inc <AAPL.O> that accused it of breaking federal antitrust laws by monopolizing the market for iPhone software applications and causing consumers to overpay.
"NOVEMBER 26, ",U.S. Supreme Court weighs antitrust dispute over Apple App Store,U.S. Supreme Court justices on Monday will take up Apple Inc's effort to bury a lawsuit seeking damages from the company for allegedly monopolizing the market for iPhone software applications and forcing consumers to overpay.
"NOVEMBER 26, ",Luxury goods group Kering steps up digital strategy with new Apple deals,"French luxury goods group Kering announced new measures to step up its digital and e-commerce presence, which is among its fastest growing areas, including new partnerships with Apple Inc.."
"NOVEMBER 25, ",How much for that app? U.S. top court hears Apple antitrust dispute,"When iPhone users want to edit blemishes out of their selfies, identify stars and constellations or simply join the latest video game craze, they turn to Apple Inc's App Store, where any software application they buy also includes a 30 percent cut for Apple."
"NOVEMBER 22, ",Top Japanese wireless carriers plan to cut iPhone XR price: WSJ,"Major Japanese wireless carriers are planning to cut the price of Apple Inc's iPhone XR as early as next week, the Wall Street Journal reported on Thursday, citing people familiar with the matter."
"NOVEMBER 21, ",Apple supplier Foxconn seeks to cut costs in 2019: Bloomberg,"Apple Inc's biggest iPhone assembler Foxconn aims to cut 20 billion yuan ($2.88 billion) from expenses in 2019 as the company faces ""a very difficult and competitive year"", Bloomberg reported on Wednesday, citing an internal memo."
"NOVEMBER 21, ","US STOCKS SNAPSHOT-Wall Street opens higher as oil prices, tech stocks recover",U.S. stocks opened higher on Wednesday after two days of heavy selling as Apple Inc and other major technology stocks bounced back and oil prices steadied.
"NOVEMBER 20, ","Best Buy boosts profit forecast, cautious on holiday earnings","Best Buy Co Inc <BBY.N> raised its full-year earnings forecast on Tuesday, as the largest U.S. consumer tech retailer sold more mobile phones and home theater systems, but stayed cautious on its outlook for the holiday shopping season."
"NOVEMBER 18, ","Apple, trade woes sink stocks; growth worries drag on dollar",World stock markets fell on Monday as worries about softening demand for the iPhone dragged down shares of Apple Inc and persistent trade tensions between China and the United States sapped investor sentiment.
"NOVEMBER 19, ","US STOCKS SNAPSHOT-Wall St tumbles, as Apple, internet stocks swoon","U.S. stocks dropped on Monday as investors dumped Apple, internet and other technology shares, further shaking confidence in a group of stocks that has propelled the long bull market."
"NOVEMBER 19, ",Apple cuts production orders for all three new iPhone models: WSJ,"Apple Inc <AAPL.O> has cut production orders in recent weeks for all three iPhone models launched in September, the Wall Street Journal reported on Monday, citing sources."
"NOVEMBER 19, ","US STOCKS-Wall St hit by Apple and Internet shares, trade worries","* Indexes sink: Dow 1.5 pct, S&P 1.5 pct, Nasdaq 2.7 pct (Updates to late afternoon)"
"NOVEMBER 19, ","GLOBAL MARKETS-Stocks weighed by Apple demand woes, trade tensions","* Wall Street hit by Apple slide, trade woes (Updates to mid-afternoon in U.S. markets, changes comment)"
"NOVEMBER 19, ","US STOCKS-Wall St hammered by Apple, trade concerns","* Indexes sink: Dow 1.55 pct, S&P 1.49 pct, Nasdaq 2.57 pct (Changes comment, updates to early afternoon)"
"NOVEMBER 19, ","US STOCKS-Wall St pulled lower by Apple, trade worries","* Indexes down: Dow 0.38 pct, S&P 0.40 pct, Nasdaq 1 pct (Updates to open)"
"NOVEMBER 19, ","US STOCKS SNAPSHOT-Wall St opens lower on Apple concerns, trade uncertainties","U.S. stocks opened lower on Monday as shares of Apple and its suppliers were hit by ongoing concerns of slowing demand for iPhones, while conflicting signals of a potential truce in the China-U.S. trade dispute added to market jitters."
"NOVEMBER 19, ","US STOCKS-Futures dip on Apple concerns, trade uncertainties","U.S. stock index futures dipped on Monday as Apple shares were hit by concerns of slowing demand for iPhones, while conflicting signals of a potential truce in the China-U.S. trade dispute added to market jitters."
"NOVEMBER 19, ",Apple cuts production orders for all 3 new iPhone models - WSJ,"IPhone maker Apple Inc has cut production orders in recent weeks for all three iPhone models launched in September, the Wall Street Journal reported on Monday, citing sources."
"NOVEMBER 15, ",Apple partners with Oscar-winning movie studio A24 for feature films,"Apple Inc <AAPL.O> has inked a multi-year deal with A24, the studio behind Oscar-winning projects ""Moonlight"" and ""Amy"", a source familiar with the plans told Reuters, as the iPhone maker pushes deeper into original content and movies."
"NOVEMBER 15, ","Apple supplier AMS cuts forecast, indicating poor iPhone demand","Austria's AMS <AMS.S>, which makes facial recognition technology, became the latest Apple supplier to cut its revenue forecast, adding to growing evidence that the latest iPhones are not selling well."
"NOVEMBER 14, ",Apple to employ trafficking survivors in efforts to eradicate slave labor,"Apple will employ trafficking survivors to work in its retails stores, the technology giant said, after winning an international award for making details of its supply chains public in a bid to help end modern slavery."
"NOVEMBER 15, ",BRIEF-Credit Suisse Says Surprised About Mobile Payment Probe,* SAYS IS CONVINCED THAT ALLEGATIONS WILL PROVE TO BE UNFOUNDED
"NOVEMBER 14, ",A matter of volume: threat from ascendant Chinese phones hangs over Apple,"A raft of profit warnings from Apple Inc <AAPL.O> suppliers this week has fueled investor concerns that iPhone sales, in terms of volume, have hit a wall that could spell trouble for the company's plans to make services its main pillar of growth."
"NOVEMBER 14, ",S&P 500 falls for fifth day as financials drag,"Wall Street stocks fell on Wednesday, with the S&P 500 notching a fifth straight day of losses as financial stocks were hit by fears that regulations on the banking industry would tighten once the Democratic Party takes control of the U.S. House of Representatives."
"NOVEMBER 14, ",Prominent managers loaded up on Apple before recent tumble,"Several prominent investors put fresh money to work in Apple <AAPL.O> during the third quarter even as they sold out of other high-flying tech companies, betting the iPhone maker's stock would keep rising as strong growth overshadowed rising trade tensions between the United..."
"NOVEMBER 14, ",US STOCKS-S&P 500 down for fifth day as financials fall,* Financials drop as Maxine Waters says regulations won't ease
"NOVEMBER 14, ","Esplanade's Kravetz bullish on casinos, Apple; sees turbulence for discount stores","Strong U.S. consumer holiday spending will not boost retailers across the board but instead benefit winners like Apple Inc <AAPL.O> that have signature products, Esplanade Capital's Shawn Kravetz said at the Reuters Global Investment 2019 Outlook Summit in New York on Wednesday..."
"NOVEMBER 14, ","US STOCKS-S&P 500 down for fifth day as Apple, bank stocks fall",* Financials drop as Maxine Waters says will not ease regulations
"NOVEMBER 14, ",Apple wins global award for efforts to eradicate slave labour,Technology giant Apple won an international award on Wednesday for making details of its supply chains public in a bid to boost transparency and help end modern slavery.
"NOVEMBER 14, ",Dialog Semi says not seeing hit to demand from Apple,"Dialog Semiconductor <DLGS.DE> said on Wednesday it was not seeing a hit to demand from its main customer, Apple Inc <AAPL.O>, after some suppliers issued profit warnings due to weakness in iPhone sales."
"NOVEMBER 14, ",US STOCKS SNAPSHOT-Wall Street gives up early gains as Apple weighs,"U.S. stocks turned lower on Wednesday as early support from tame consumer prices data and a rebound in oil prices faded, with Apple Inc leading a decline in technology stocks."
"NOVEMBER 13, ",Qorvo joins other Apple suppliers in cutting forecast,"Apple supplier Qorvo Inc <QRVO.O> cut its third-quarter forecast for profit and revenue on Tuesday, joining a handful of suppliers to the iPhone maker that have warned of an earnings hit due to lower demand from a major customer."
"NOVEMBER 13, ","US STOCKS-Wall St rises on trade hope, Apple limits tech recovery","* Indexes: Dow down 0.21 pct, S&P up 0.17 pct, Nasdaq up 0.21 pct (Updates to open)"
