Date,Headline,Sentence
"OCTOBER 5, 20",Sales at Taiwan's Apple supplier Hon Hai flat in September,"Sales at Hon Hai Precision Industry <2317.TW>, known by its trade name Foxconn and as a key supplier of Apple Inc's <AAPL.O> products, rose by 0.5% rise in September."
"OCTOBER 4, 20",Apple rolls out free repair for iPhone 6S devices that do not turn on,"Apple Inc said on Friday some iPhone 6S and iPhone 6S Plus handsets may not power on due to a failed component, and the company is offering to repair the devices for free."
"OCTOBER 4, 20",Amazon Prime Video back after brief disappearance from Apple's app stores,"Amazon Inc's streaming service, Prime Video, was once again available on Apple Inc's app stores after briefly disappearing on Friday due to a technical glitch."
"OCTOBER 4, 20",Exclusive: Antitrust probers in Congress ask Spotify to detail alleged Apple abuses - sources,"U.S. lawmakers have requested information from Apple critic Spotify as part of an antitrust probe, according to two sources briefed on the investigation into allegations the iPhone maker engages in anti-competitive behavior to support its own apps."
"OCTOBER 4, 20",Amazon Prime Video disappears from Apple's app stores,"Amazon Inc's streaming service, Prime Video, disappeared from Apple Inc's app store on Friday."
"OCTOBER 4, 20","BUZZ-U.S. STOCKS ON THE MOVE-Apple, Snap, PepsiCo, HP",* Eikon search string for individual stock moves: * The Day Ahead newsletter: http://tmsnrt.rs/2ggOmBi * The Morning News Call newsletter: http://tmsnrt.rs/2fwPLTh U.S. stocks climbed on Friday as moderate jobs growth in September offered some relief from a spate of dismal...
"OCTOBER 4, 20","US STOCKS-S&P 500, Dow headed for best day in a month after 'Goldilocks' jobs data","* Indexes up: Dow 0.90%, S&P 0.92%, Nasdaq 0.94% (Updates to early afternoon)"
"OCTOBER 4, 20","US STOCKS-""Goldilocks"" jobs report, bets of Fed rate cut boost Wall Street",* HP Inc falls after announcing $1 bln charge from restructuring
"OCTOBER 4, 20",Apple raises production of iPhone 11 models by about 10%: Nikkei,"Apple Inc <AAPL.O> has asked suppliers to increase production of its iPhone 11 models by up to 8 million units, or about 10%, Nikkei Asian Review reported, hinting that demand for the recently launched versions of its flagship phone was picking up."
"OCTOBER 4, 20",US STOCKS-Jobs report lifts Wall Street; S&P 500 still tracks worst week in six,* HP Inc falls after announcing $1 bln charge from restructuring
"OCTOBER 4, 20","European shares higher on hopes of Fed action, chip stocks gain on Apple report","European shares rose on Friday as investors were hopeful of further monetary easing from the U.S. Federal Reserve in the wake of poor economic data, while chip stocks nudged higher after a report said Apple was increasing production of its new iPhone models."
"OCTOBER 3, 20",Apple chief weighs in against setting up digital currency,"Apple Inc Chief Executive Tim Cook has weighed in against launching an Apple cryptocurrency, saying in remarks published on Thursday that companies should not be trying to gain power by establishing competing currencies."
"OCTOBER 3, 20","Apple CEO sees U.S.-China trade deal, hopes tariffs dropped",Apple's chief executive Tim Cook said in an interview published in a French newspaper on Thursday that he was hopeful the United States and China would reach a trade deal and it was vital for both countries to go back on their mutual tariffs.
"OCTOBER 2, 20","Apple CEO Cook opposes Trump, backs 'dreamer' immigrants in Supreme Court",Apple Inc CEO Tim Cook on Wednesday filed a brief at the U.S. Supreme Court opposing President Donald Trump's effort to end a program that protects from deportation hundreds of thousands of immigrants who were brought into the United States illegally as children.
"OCTOBER 1, 20","Japan shares gain as tankan less downbeat than expected, Navarro eases trade fears","Japanese stocks rose on Tuesday as deterioration in the Bank of Japan's tankan survey was less than expected, and gains were led by blue-chip exporters and Apple-related shares."
"SEPTEMBER 30,","Tokyo stocks lifted by blue-chip exporters, Apple-related names","Japanese shares rose on Tuesday, shrugging off signs of worsening confidence among big manufacturers, with blue-chip exporters and Apple-related issues leading the gains."
"SEPTEMBER 30,",Apple and Microsoft push Wall Street higher as trade worries abate,"U.S. stocks climbed on Monday, helped by gains in Apple, Microsoft and Merck & Co, as investors set aside worries about the U.S.-China trade war."
"SEPTEMBER 30,","US STOCKS SNAPSHOT-Wall Street ends higher on back of buoyant Apple, Microsoft","U.S. stocks rose on Monday, helped by gains in Apple, Microsoft and Merck & Co as investors set aside worries about the U.S.-China trade war."
"SEPTEMBER 30,",US STOCKS-Apple and Merck drive Wall Street higher as trade worries abate,"* Apple up on JPM's iPhone volume forecast raise, Cook's comments"
"SEPTEMBER 30,",US STOCKS-Apple-led tech rally drives Wall Street higher,"* Apple up on JPM's iPhone volume forecast raise, Cook's comments"
"SEPTEMBER 30,",US STOCKS SNAPSHOT-Wall Street opens higher on Apple boost,"Wall Street's main indexes opened higher on Monday, lifted by Apple Inc, as investors shrugged off last week's reports that Washington was considering delisting Chinese companies from U.S. stock exchanges."
"SEPTEMBER 27,",Apple will seek theater deals for movies before streaming: WSJ,"Apple Inc plans to give its feature-length film productions extended theatrical releases before making them available on its streaming TV service, the Wall Street Journal reported on Friday."
"SEPTEMBER 26,","Apple supplier Japan Display loses out on Chinese funds, bailout at risk","Apple Inc <AAPL.O> supplier Japan Display Inc <6740.T> said on Thursday that Chinese investment firm Harvest Group would withdraw from a bailout of the cash-strapped smartphone screen maker, increasing the chance of the 80 billion yen ($743 million) deal collapsing."
"SEPTEMBER 26,",Chinese fund Harvest declines financial support for Apple supplier Japan Display - Nikkei,"Japan Display Inc has been informed by Chinese investment firm Harvest Group that it will not provide financial support to the cash-strapped Apple Inc supplier, the Nikkei said on Thursday. (Reporting by Takashi Umekawa; Editing by Clarence Fernandez)"
"SEPTEMBER 23,","US STOCKS-Wall St edges higher with Apple, though economic data mixed",* Sept flash services jobs shrink for the first time in 9-1/2 yrs
"SEPTEMBER 23,","Oprah picks slavery novel for Apple TV book venture, says done with talk shows",Oprah Winfrey on Monday announced the first pick of her revamped popular book club with Apple's new television streaming service but made clear she had no plans to return to hosting a regular TV talk show.
"SEPTEMBER 23,",Apple to make new Mac Pro PCs in U.S. after some tariff exemptions,"Apple Inc <AAPL.O> said on Monday it will make new Mac Pro desktop computers at its Austin, Texas facility, following some relief on tariffs by the U.S. government."
"SEPTEMBER 19,",Wall Street mixed as Microsoft climbs and Apple dips,"Wall Street ended mixed on Thursday, with a gain in Microsoft offsetting a dip in Apple, a day after the Federal Reserve cut interest rates as expected and left the door open for further monetary easing."
"MARCH 2, 2016","US STOCKS SNAPSHOT-Wall Street ends mixed as Microsoft, Apple offset","Wall Street ended mixed on Thursday, with a dip in Apple Inc shares offsetting a gain in Microsoft Corp shares a day after the Federal Reserve cut interest rates as expected and left the door open for further monetary easing."
"SEPTEMBER 18,","Huawei talks up own apps with Mate 30 challenge to Apple, Samsung","Huawei [HWT.UL] unveiled its new smartphones to challenge Apple's <AAPL.O> iPhone 11 on Thursday, talking up slick design and best-in-class features while playing down concerns about the lack of access to Google's <GOOGL.O> popular apps."
"SEPTEMBER 19,",Huawei seeks to upstage Apple with Mate 30 smartphone launch,"Huawei [HWT.UL] launched its Mate 30 range of smartphones on Thursday, saying its cameras were superior, its wraparound screen brighter and its dimensions more compact than Apple's iPhone 11 Pro Max launched last week."
"SEPTEMBER 18,",Apple taps recycled rare earth elements for iPhone parts,"Apple Inc's new iPhones will use recycled rare earth elements in a key component, the company said on Wednesday."
"SEPTEMBER 18,",Apple taps recycled rare earth elements for iPhone parts,"Apple Inc's new iPhones will used recycled rare earth elements in a key component, the company said on Wednesday."
"SEPTEMBER 16,",Apple says $14 billion EU tax order 'defies reality and common sense',"The European Union's order to Apple to pay 13 billion euros ($14 billion) in back taxes ""defies reality and common sense"", the U.S. firm said as the two sides sparred in a case key to the EU's crackdown on sweetheart deals to multinationals."
"SEPTEMBER 17,",Apple awards iPhone supplier Corning $250 million from U.S. manufacturing fund,Apple Inc on Tuesday said it would award Corning Inc $250 million from a $5 billion fund dedicated to U.S. advanced manufacturing.
"SEPTEMBER 16,",Order checks for Apple's new iPhone bode well: analysts,"Pre-orders for Apple Inc's latest iPhones have gotten off to a better start than the last cycle a year ago, several Wall Street analysts said on Monday, citing their own research data."
"SEPTEMBER 16,","In a surprise move, Foxconn's Gou drops Taiwan's presidential bid","Terry Gou, founder of Apple supplier Foxconn <2317.TW>, in a surprise move on Monday said he will not contest in Taiwan's 2020 presidential election."
"SEPTEMBER 15,",Apple TV+ premieres with star-studded period drama 'Dickinson' at Tribeca Festival,"Apple TV+ premiered its first show at the Tribeca TV Festival on Saturday, flaunting feminist snark, lavish period costumes and a star-studded cast in ""Dickinson,"" a series that sheds a modern light on the life of an iconic American poet."
"SEPTEMBER 13,",Disney CEO Bob Iger resigns from Apple board as TV battle looms,Apple Inc <AAPL.O> said on Friday that Walt Disney Co <DIS.N> Chief Executive Officer Bob Iger had resigned from the company's board of directors on Sept. 10 as the two companies prepare to compete head-to-head in the streaming television business.
"SEPTEMBER 13,",Apple's app store eyed in U.S. Congress antitrust probe,The U.S. House Judiciary Committee on Friday requested information from Apple Inc Chief Executive Tim Cook as part of an investigation of competition in digital markets.
"SEPTEMBER 13,","Apple, Facebook, Amazon, Google emails demanded in U.S. House panel probe","A U.S. House of Representatives panel on Friday demanded internal emails, detailed financial information and other company records from top executives of Amazon.com Inc., Facebook Inc, Apple Inc, and Alphabet Inc's Google, widening the antitrust probe of Big Tech."
"SEPTEMBER 13,",Apple has sour reaction to Goldman Sachs' analyst note,Apple Inc <APPL.O> struck out at a Goldman Sachs Group Inc <GS.N> analyst on Friday in a relatively rare public dust-up between a blue chip Wall Street firm and its client.
"SEPTEMBER 13,",Disney CEO Bob Iger resigns from Apple board,Apple Inc said https://www.sec.gov/ix?doc=/Archives/edgar/data/320193/000032019319000093/a8-kseptember201991019.htm on Friday Walt Disney Co Chief Executive Officer Bob Iger had resigned from the company's board of directors on Sept. 10. (Reporting by Arjun Panchadar in...
"SEPTEMBER 13,",US STOCKS-Wall Street mixed as trade hopes capped by Apple drop,"* China announces tariff exemptions, Trump open to interim deal"
"SEPTEMBER 13,","US STOCKS-Apple, Broadcom keep Wall Street gains in check",* Trump says potentially open to interim trade deal with China
"SEPTEMBER 13,","US STOCKS-Apple, Broadcom rein in Wall Street gains on trade optimism",* Trump says potentially open to interim trade deal with China
"SEPTEMBER 13,","US STOCKS-Apple, Broadcom hold back Wall Street gains",* Trump says potentially open to interim trade deal with China
"SEPTEMBER 12,",Apple's new iPhones shift smartphone camera battleground to AI,"When Apple Inc <AAPL.O> introduced its triple-camera iPhone this week, marketing chief Phil Schiller waxed on about the device's ability to create the perfect photograph by weaving it together with eight separate exposures captured before the main shot, a feat of ""computational..."
"SEPTEMBER 11,","Apple may steal Netflix streaming crown, but only for a year","Apple Inc's move to offer a free TV+ subscription for a year with every new device may briefly crown the iPhone maker as the biggest streaming service by user numbers, leapfrogging Netflix Inc."
"SEPTEMBER 11,","US STOCKS-Wall Street rises on Apple, trade optimism","* Indexes up: Dow 0.37%, S&P 500 0.39%, Nasdaq 0.76% (Updates market action, adds comments)"
"SEPTEMBER 11,","Apple's new, lower priced iPhone draws tepid response in Asia","Apple Inc's <AAPL.O> new, lower priced iPhone that comes with a faster processor but lacks 5G technology disappointed Asia, where cheaper and feature-packed handsets from rivals are already available."
"SEPTEMBER 11,",Tepid reaction for Apple's new iPhones in China amid tough competition,"A lower price tag and new features may not be enough for Apple Inc to win customers for its newly-launched iPhone 11 series in China, the world's largest smartphone market that is already crowded with cheaper and feature-packed rival handsets."
"SEPTEMBER 10,","Japan shares at 6-week high as banks, exporters, Apple suppliers shine","Japanese stocks rose to a six-week high on Wednesday as bank shares extended recent gains thanks to rising bond yields, while major exporters reaped the rewards of a faltering yen."
"SEPTEMBER 10,",Apple reveals triple-camera iPhone; $5 monthly streaming TV undercuts Disney,"Apple Inc <AAPL.O> caught up with hardware rivals on Tuesday by revealing a triple-camera iPhone, and it rolled out a streaming TV service priced at $5 a month, undercutting Disney and Netflix."
"SEPTEMBER 10,",Breakingviews - Apple TV could be pilot for more dramatic things,"Apple is known for the cleanness of its smartphone designs, yet its TV plans have until now been full of static. On Tuesday, the $970 billion company made things a tad clearer, by announcing that its new Apple TV+ package will be cheaper than rivals. That doesn’t guarantee..."
"SEPTEMBER 10,","Apple leans on devices business in global battle against Disney, Netflix","Apple Inc <AAPL.O>, the company that transformed the music, mobile and personal computing industries, is relying on the ubiquity of its iPhones and iPads to take on Disney and Netflix in the battle for streaming TV customers."
"SEPTEMBER 10,",Factbox: Apple's streaming TV service to cost $4.99/month; unveils new iPhones,"Apple Inc <AAPL.O> on Tuesday launched a new streaming TV service, which will showcase original shows at a monthly price of $4.99, and unveiled three iPhone models featuring new camera systems."
"SEPTEMBER 10,","UPDATE 2-Apple leans on devices business in global battle against Disney, Netflix","Apple Inc, the company that transformed the music, mobile and personal computing industries, is relying on the ubiquity of its iPhones and iPads to take on Disney and Netflix in the battle for streaming TV customers."
"SEPTEMBER 10,","Apple leans on devices business in global battle against Disney, Netflix","Apple Inc, the company that transformed the music, mobile and personal computing industries, is relying on the ubiquity of its iPhones and iPads to take on Disney and Netflix in the battle for streaming TV customers."
"SEPTEMBER 10,",Apple to reveal streaming service prices while iPhones on 'holding pattern' until 5G,"Apple Inc is set on Tuesday to announce pricing for its forthcoming streaming TV service as well as updates to its iPhone lineup, as the tech giant reaches a turning point where it focuses as much on services as its hardware and software."
"SEPTEMBER 9, ","Apple, Foxconn say they overly relied on temporary workers in China","Apple Inc and manufacturing partner Foxconn Technology Co Ltd on Monday rebutted allegations of lapses in people management leveled by a non-profit monitor of worker rights, though confirmed they employed too many temporary workers."
"SEPTEMBER 9, ",Apple alters search algorithms to deliver fewer of its own apps: NYT,"Apple Inc, following antitrust scrutiny in Europe and the United States, has altered the search algorithm for its App Store so that the company's own apps do not dominate the top positions, the New York Times reported on Monday."
"SEPTEMBER 9, ","Apple may spark upgrade rush with new iPhones, tight pricing","Apple Inc <AAPL.O> could sell as many as 200 million of its latest iPhones from existing users upgrading their older devices and much of that demand will come from China despite an ongoing trade war, several Wall Street analysts said on Monday."
"SEPTEMBER 6, ",Apple says Uighurs targeted in iPhone attack but disputes Google findings,"Apple Inc on Friday confirmed that China's Uighurs, a mostly Muslim minority group considered a security threat by Beijing, had been the target of attacks due to iPhone security flaws, but disputed rival Alphabet Inc's description of the effort to track users of the smartphone..."
"SEPTEMBER 6, ",Apple defeats speaker patent case at Fed Circuit,"Apple Inc won an appeals court decision on Friday that likely finishes off a patent infringement case brought against it by an audio technology firm founded by ""Star Wars"" filmmaker George Lucas."
"SEPTEMBER 6, ",Apple disputes Google security researcher findings on iPhone attack,Apple Inc on Friday disputed the way that researchers at Alphabet Inc's cybersecurity team characterized an iPhone security flaw that they said could be used to track users of the smartphone in real time.
"SEPTEMBER 5, ",Apple places $7 billion in return to bond market,"Apple Inc <AAPL.O> said on Thursday it had sold $7 billion of bonds at yields ranging up to 103 basis points over the equivalent U.S. Treasury on maturities of up to 30 years, its first such debt issues since November 2017."
"SEPTEMBER 4, ",Apple seeks to raise $7 billion in return to bond market: IFR,"Apple Inc is looking to raise $7 billion through a sale of bonds set to price later on Wednesday, IFR reported, the company's first such issue since November 2017."
"AUGUST 29, 20",Apple likely to unveil latest iPhone on September 10,"Apple Inc <AAPL.O> will host an event on Sept. 10 at the Steve Jobs Theater in the company's Cupertino, California campus, where it is widely expected to unveil new iPhone models."
"AUGUST 29, 20",Apple to supply parts to independent repair shops for first time,"Apple Inc <AAPL.O> said on Thursday it will begin selling parts, tools and repair guides to independent shops to fix broken iPhones, a major change after years of lobbying against laws in some U.S. states that would have compelled it to do just that."
"AUGUST 29, 20",CORRECTED-Apple to supply parts to independent repair shops for first time,"Apple Inc said on Thursday it will begin selling parts, tools and repair guides to independent shops to fix broken iPhones, a major change after years of lobbying against laws in some U.S. states that would have compelled it to do just that."
"AUGUST 28, 20",Apple to stop default practice of keeping Siri recordings,Apple Inc <AAPL.O> on Wednesday said it would quit its default practice of retaining audio recordings of the requests users make to its Siri personal assistant and limit human review of what audio it does collect to its own employees rather than contractors.
"AUGUST 28, 20",Apple's data shows a deepening dependence on China as Trump's tariffs loom,"Tapping factories in Brazil and India has not lessened Apple Inc's <AAPL.O> dependence on China, the company's supply chain data shows, raising the stakes for the iPhone maker as U.S. President Donald Trump wages a trade war and promises more tariffs."
"AUGUST 28, 20",Fitbit unveils Versa 2 smartwatch with Amazon Alexa,"Fitbit Inc <FIT.N> on Wednesday launched its latest smartwatch, Versa 2, adding Amazon.com Inc's <AMZN.O> voice assistant Alexa, online payments and music storage in a bid to compete strongly with Apple Inc's <AAPL.O> smartwatches."
"AUGUST 28, 20",Apple says to restart Siri reviews with new controls,Apple Inc users will be able to opt out of the company reviewing their conversations with voice assistant Siri under measures announced on Wednesday to address concerns over how it holds and uses audio recordings.
"AUGUST 21, 20",Apple plans to tap China's BOE Technology for advanced iPhone screens: Nikkei,"Apple Inc <AAPL.O> is in the final stages of certifying advanced screens from Chinese display maker BOE Technology Group Co Ltd <000725.SZ> for its iPhones, as it attempts to reduce reliance on Samsung Electronics, the Nikkei reported on Wednesday."
"AUGUST 20, 20",Goldman CEO memo calls Apple Card 'a beginning' on launch day,"Goldman Sachs Group Inc <GS.N> officially became a credit-card lender on Tuesday by rolling out its first product with Apple Inc <AAPL.O>, but the bank has aspirations to grow much bigger in consumer lending, its chief executive said in an internal memo viewed by Reuters."
"AUGUST 20, 20","On Apple Card launch day, Goldman CEO says card is ""a beginning"" -memo","Goldman Sachs Group Inc officially became a credit-card lender on Tuesday by rolling out its first product with Apple Inc, but the bank has aspirations to grow much bigger in consumer lending, its chief executive said in an internal memo viewed by Reuters."
"AUGUST 20, 20","Nikkei gains as trade tensions ease; Apple suppliers, chip-related shares outperform",Japan's Nikkei rose for a third straight day on Tuesday as investors tiptoed back into equities amid signs of a slight easing of trade tensions between the United States and China.
"AUGUST 19, 20","Nikkei inches higher; Apple suppliers, chip-related shares outperform","Japanese shares edged up on Tuesday as investors tiptoed back into equities, amid signs of a slight easing of trade tensions between the United States and China and continued hopes for fresh stimulus moves by major economies."
"AUGUST 18, 20","Apple CEO warns Trump about China tariffs, Samsung competition",President Donald Trump said on Sunday that he had spoken with Apple Inc's Chief Executive Tim Cook about the impact of U.S. tariffs on Chinese imports as well as competition from South Korean company Samsung Electronics Co Ltd.
"AUGUST 18, 20",US STOCKS SNAPSHOT-Futures rise as Trump says he spoke with Apple CEO on tariffs,U.S. stock futures rose on Sunday after President Donald Trump said he had discussed the impact of U.S. tariffs on Chinese goods with Apple Chief Executive Tim Cook.
"AUGUST 18, 20","Apple CEO warns Trump about China tariffs, Samsung competition",U.S. President Donald Trump said on Sunday that he has spoken with Apple Inc's Chief Executive Tim Cook about the impact of U.S. tariffs on Chinese imports as well as competition from South Korean company Samsung Electronics Co Ltd.
"AUGUST 16, 20",Trump says he is having dinner Friday with Apple CEO Cook,"U.S. President Donald Trump said he was having dinner on Friday with Chief Executive Officer Tim Cook of Apple Inc, a company the president has criticized for not manufacturing more of its products in the United States."
"AUGUST 16, 20",UPDATE 1-Trump says he is having dinner Friday with Apple CEO Cook,"U.S. President Donald Trump said he was having dinner on Friday with Chief Executive Officer Tim Cook of Apple Inc, a company the president has criticized for not manufacturing more of its products in the United States."
"AUGUST 15, 20",Apple says it supports 2.4 million U.S. jobs,"Apple Inc said on Wednesday it was either directly or indirectly responsible for 2.4 million U.S. jobs, up 20% from the 2 million the technology company estimated in 2017."
"AUGUST 14, 20",Japan shares rise sharply on Trump's tariff delay; Apple suppliers soar,"Japanese stocks on Wednesday recouped nearly all of the previous day's sharp losses, thanks to Washington delaying the start of tariffs on some Chinese imports."
"AUGUST 13, 20",Japanese stocks rebound on Trump's tariff delay; Apple suppliers shine,"Japanese stocks bounced on Wednesday, after Washington delayed tariffs on some Chinese imports in much-needed reprieve for markets, with chipmaking sectors and Apple-related firms enjoying the tailwind the most."
"AUGUST 13, 20",U.S. aviation regulator bans select MacBook Pro laptops from flights,"U.S. Federal Aviation Administration (FAA) has banned certain models of Apple Inc's <AAPL.O> MacBook Pro laptops on flights, after the company recalled select units which had batteries posing fire risks."
"AUGUST 13, 20",UPDATE 2-Apple's AirPods will not escape Trump's China tariffs,"Apple Inc's AirPods, Apple Watch and HomePod, which have helped the company offset waning sales of its bestselling iPhone this year, are not included in a temporary reprieve on tariffs by the Trump administration and will face a 10% levy on Sept 1."
"AUGUST 13, 20",Apple's AirPods will not escape Trump's China tariffs,"Apple Inc's <AAPL.O> AirPods, Apple Watch and HomePod, which have helped the company to offset waning sales of its bestselling iPhone this year, are not included in a temporary reprieve on tariffs by the Trump administration and will face a 10% levy on Sept 1."
"AUGUST 13, 20",US STOCKS-Apple drives Wall Street higher as U.S. delays some tariffs,"* Indexes up: Dow 1.61%, S&P 1.68%, Nasdaq 2.00% (Updates prices to early afternoon)"
"AUGUST 13, 20",US STOCKS-Apple leads Wall Street rally as U.S. delays on tariffs,"* Indexes up: Dow 1.59%, S&P 1.54%, Nasdaq 1.94% (Changes comment, updates prices)"
